{"bundle_count":6,"bundles":[{"baseline_report_ref":{"path":"data/discovery/wave_69/stage_a/052f4191fdcbb6fa45716b97cc85949f8c2287c75d532893084955ab7c666122/baseline-report.json","report_id":"baseline-report-sha256:16c173bb1649ad62c83585969c32d763f1aa7c83c741d6ab1c62016e53398a83","schema_version":"partizan.baseline_report.v0.1","sha256":"3d1578e80db8f2d1b0c6e5b8e58461c41fb554395d77f9e18865122368bcc4ff"},"policy_orders_ref":{"path":"data/discovery/wave_69/stage_a/052f4191fdcbb6fa45716b97cc85949f8c2287c75d532893084955ab7c666122/policy-orders.json","policy_orders_id":"policy-orders-sha256:d5aa088c2abc5736ed1049569f4db7aba2d510ed8bab72b716c12fd30b41d64d","schema_version":"partizan.policy_orders.v0.1","sha256":"b37915bb0a2b0769510920ff6d840834c95841230f952c8bc13478d590e0921b"},"pool_id":"pool-sha256:a75370e363bb127495411f57531d9a5a1fc0bd7997888218a70c2f87623ec273","pool_manifest_ref":{"path":"data/discovery/wave_69/stage_a/052f4191fdcbb6fa45716b97cc85949f8c2287c75d532893084955ab7c666122/pool-manifest.json","pool_id":"pool-sha256:a75370e363bb127495411f57531d9a5a1fc0bd7997888218a70c2f87623ec273","schema_version":"partizan.candidate_pool_manifest.v0.2","sha256":"e62ce8a7bef586e62411048891c93b9278d704e46bc466d64346e44e4b43bc41"},"proposals_ref":{"path":"data/discovery/wave_69/stage_a/052f4191fdcbb6fa45716b97cc85949f8c2287c75d532893084955ab7c666122/proposals.jsonl","row_count":1024,"schema_version":"partizan.candidate_proposal.v0.1","sha256":"d2a5007461ae2f69193cd3147f4c834bb35228841c20e9fff37e73e353d557b9"},"target_id":"target-sha256:052f4191fdcbb6fa45716b97cc85949f8c2287c75d532893084955ab7c666122","target_ref":{"path":"data/discovery/wave_69/stage_a/052f4191fdcbb6fa45716b97cc85949f8c2287c75d532893084955ab7c666122/target.json","schema_version":"partizan.discovery_target.v0.1","sha256":"57921821c322d3d82c3c44eb385ef25b72b333655f83e7864f290c69cb606041","target_id":"target-sha256:052f4191fdcbb6fa45716b97cc85949f8c2287c75d532893084955ab7c666122"},"verifier_results_ref":{"path":"data/discovery/wave_69/stage_a/052f4191fdcbb6fa45716b97cc85949f8c2287c75d532893084955ab7c666122/verifier-results.jsonl","row_count":1024,"schema_version":"partizan.verifier_result.v0.1","sha256":"d87267459d1f406478d7752ee42ddcadafb21c9e898765bcf705dcfd40308c9b"}},{"baseline_report_ref":{"path":"data/discovery/wave_69/stage_a/07de65c35e848be61c6f96872b1b20f3a101efa9b461750c502060842599e0c6/baseline-report.json","report_id":"baseline-report-sha256:9a947c56ad1dbe54d9e75547b37b0886fc0d210a01a4a1fa99bb9357e24c10e8","schema_version":"partizan.baseline_report.v0.1","sha256":"c3ef508a73585bd3bae8041e53fcf013555d613f99fcc489e7d8c9a7a8ce2803"},"policy_orders_ref":{"path":"data/discovery/wave_69/stage_a/07de65c35e848be61c6f96872b1b20f3a101efa9b461750c502060842599e0c6/policy-orders.json","policy_orders_id":"policy-orders-sha256:8126bde39d6bdf48d21ea2116f8c2a68e6538110e9ce5f5718d484993e4d470a","schema_version":"partizan.policy_orders.v0.1","sha256":"309a6255560552356bd08105627b1a860a30ec22e452fcd82162adc830763804"},"pool_id":"pool-sha256:f951093789b541975c6f1cc3fcfbe71318dd3f62a83f7f992c0c10968b8e108f","pool_manifest_ref":{"path":"data/discovery/wave_69/stage_a/07de65c35e848be61c6f96872b1b20f3a101efa9b461750c502060842599e0c6/pool-manifest.json","pool_id":"pool-sha256:f951093789b541975c6f1cc3fcfbe71318dd3f62a83f7f992c0c10968b8e108f","schema_version":"partizan.candidate_pool_manifest.v0.2","sha256":"f6c6efbc0943700aecc57312ae3156955dc497b23d005a8c2e8c91adf8180f32"},"proposals_ref":{"path":"data/discovery/wave_69/stage_a/07de65c35e848be61c6f96872b1b20f3a101efa9b461750c502060842599e0c6/proposals.jsonl","row_count":1024,"schema_version":"partizan.candidate_proposal.v0.1","sha256":"46b4c994bcdbb966b70d091a65a5fff4d8137be0ae37c026ae6bfb0faf92cf28"},"target_id":"target-sha256:07de65c35e848be61c6f96872b1b20f3a101efa9b461750c502060842599e0c6","target_ref":{"path":"data/discovery/wave_69/stage_a/07de65c35e848be61c6f96872b1b20f3a101efa9b461750c502060842599e0c6/target.json","schema_version":"partizan.discovery_target.v0.1","sha256":"a307dc1239e7c59428444bbfb2f7ff5942121bc37ea623213fd37a56c80b92bc","target_id":"target-sha256:07de65c35e848be61c6f96872b1b20f3a101efa9b461750c502060842599e0c6"},"verifier_results_ref":{"path":"data/discovery/wave_69/stage_a/07de65c35e848be61c6f96872b1b20f3a101efa9b461750c502060842599e0c6/verifier-results.jsonl","row_count":1024,"schema_version":"partizan.verifier_result.v0.1","sha256":"2d8257d1006c13b7a11833ed8f0c188ad165d36bcead650cf934292eba247d02"}},{"baseline_report_ref":{"path":"data/discovery/wave_69/stage_a/41bb336e2bee89d4bdf6b5b7a9d9e1c3c8e1fd27da111dbaecac18ae9e553d6a/baseline-report.json","report_id":"baseline-report-sha256:726dd4307f1d7a28b90e6c96bea09f959b892c2baf3ae12384f0b21877a63387","schema_version":"partizan.baseline_report.v0.1","sha256":"8ee35cede4c423ed0e5b9248bc39ea7f9ba46140a8773a9f5d7ce73b861f97fc"},"policy_orders_ref":{"path":"data/discovery/wave_69/stage_a/41bb336e2bee89d4bdf6b5b7a9d9e1c3c8e1fd27da111dbaecac18ae9e553d6a/policy-orders.json","policy_orders_id":"policy-orders-sha256:518648670921b323b3f261a8660c513e0f8e66c7db0ca2e5c034339928f48db1","schema_version":"partizan.policy_orders.v0.1","sha256":"53b4575f81b403a881a1f066c849a8fb30e98208ea4d84d4148a3b947dc18fcd"},"pool_id":"pool-sha256:027ba75d52c981c3a5906e9d2ab693a0034b4de0cf8973e8b07a46d9e4c5e2d6","pool_manifest_ref":{"path":"data/discovery/wave_69/stage_a/41bb336e2bee89d4bdf6b5b7a9d9e1c3c8e1fd27da111dbaecac18ae9e553d6a/pool-manifest.json","pool_id":"pool-sha256:027ba75d52c981c3a5906e9d2ab693a0034b4de0cf8973e8b07a46d9e4c5e2d6","schema_version":"partizan.candidate_pool_manifest.v0.2","sha256":"09fe3939ad41ede035784ababcfb260dad45779890824a9a2ea79178abb70d5d"},"proposals_ref":{"path":"data/discovery/wave_69/stage_a/41bb336e2bee89d4bdf6b5b7a9d9e1c3c8e1fd27da111dbaecac18ae9e553d6a/proposals.jsonl","row_count":1024,"schema_version":"partizan.candidate_proposal.v0.1","sha256":"3958136c7b78b4a6abc774a58133e6ca841d14cdcfe75d6f9af999a227d5ba68"},"target_id":"target-sha256:41bb336e2bee89d4bdf6b5b7a9d9e1c3c8e1fd27da111dbaecac18ae9e553d6a","target_ref":{"path":"data/discovery/wave_69/stage_a/41bb336e2bee89d4bdf6b5b7a9d9e1c3c8e1fd27da111dbaecac18ae9e553d6a/target.json","schema_version":"partizan.discovery_target.v0.1","sha256":"3dbce1bf72526ab8cb8849d0c437be2e17122896512573f9989153251c15c896","target_id":"target-sha256:41bb336e2bee89d4bdf6b5b7a9d9e1c3c8e1fd27da111dbaecac18ae9e553d6a"},"verifier_results_ref":{"path":"data/discovery/wave_69/stage_a/41bb336e2bee89d4bdf6b5b7a9d9e1c3c8e1fd27da111dbaecac18ae9e553d6a/verifier-results.jsonl","row_count":1024,"schema_version":"partizan.verifier_result.v0.1","sha256":"59eb7b9aeb329e8e41b8123ee69693b2f91d36f9a630dd304b2dc3816cbd2cac"}},{"baseline_report_ref":{"path":"data/discovery/wave_69/stage_a/73492503d817eb3406951fa9fbe127e8f362401b7d9d695163d7e0c4b1ecdc00/baseline-report.json","report_id":"baseline-report-sha256:764b8dd8dd00c4a54811a470f59756edb804ea913447876c6ba05992e4eeb24c","schema_version":"partizan.baseline_report.v0.1","sha256":"6730c9766ea5194c0927b7065fb09e04401d1301cd162d142f73ec8bf445852b"},"policy_orders_ref":{"path":"data/discovery/wave_69/stage_a/73492503d817eb3406951fa9fbe127e8f362401b7d9d695163d7e0c4b1ecdc00/policy-orders.json","policy_orders_id":"policy-orders-sha256:a1a5e821924347b5101e866d7b443a27910068048f38b1081407e85c22844dcd","schema_version":"partizan.policy_orders.v0.1","sha256":"dd73e37a7ad9132816917c5f8357f1e982913e85e19fd093befdad4eae0d8194"},"pool_id":"pool-sha256:6a85c7a3fe82d5710f2d81e3e26f9fd14cab5ee7a5c07f9dfae07bdc50805fc6","pool_manifest_ref":{"path":"data/discovery/wave_69/stage_a/73492503d817eb3406951fa9fbe127e8f362401b7d9d695163d7e0c4b1ecdc00/pool-manifest.json","pool_id":"pool-sha256:6a85c7a3fe82d5710f2d81e3e26f9fd14cab5ee7a5c07f9dfae07bdc50805fc6","schema_version":"partizan.candidate_pool_manifest.v0.2","sha256":"1f5049553d09054eededee1c6c77a990e1fe24f51e22cd2d10deec67feca9cbb"},"proposals_ref":{"path":"data/discovery/wave_69/stage_a/73492503d817eb3406951fa9fbe127e8f362401b7d9d695163d7e0c4b1ecdc00/proposals.jsonl","row_count":1024,"schema_version":"partizan.candidate_proposal.v0.1","sha256":"180646a31053c01f060bef58fdbb4a0f2e0e28e2a58c63cade27b744a4bc3a01"},"target_id":"target-sha256:73492503d817eb3406951fa9fbe127e8f362401b7d9d695163d7e0c4b1ecdc00","target_ref":{"path":"data/discovery/wave_69/stage_a/73492503d817eb3406951fa9fbe127e8f362401b7d9d695163d7e0c4b1ecdc00/target.json","schema_version":"partizan.discovery_target.v0.1","sha256":"89aa4fd525615007189340b2e0da6703b52240e9b6490bd6f5238d0285cb9a63","target_id":"target-sha256:73492503d817eb3406951fa9fbe127e8f362401b7d9d695163d7e0c4b1ecdc00"},"verifier_results_ref":{"path":"data/discovery/wave_69/stage_a/73492503d817eb3406951fa9fbe127e8f362401b7d9d695163d7e0c4b1ecdc00/verifier-results.jsonl","row_count":1024,"schema_version":"partizan.verifier_result.v0.1","sha256":"137266117d7f1b2ffc04b972165382fcee4db47d28eb16bff146e38d4980cb90"}},{"baseline_report_ref":{"path":"data/discovery/wave_69/stage_a/8ceee173bf9c9f8e498a058ba15e2d6e4d37ec3ce0b2b7caf8607ac63744ab5b/baseline-report.json","report_id":"baseline-report-sha256:2f0e0fc43e30b4ce8a7ad2b07bd687f43fc54baf081f19755ce68b9ad33ad5f5","schema_version":"partizan.baseline_report.v0.1","sha256":"3918edaa309e648a83e5b78caeaf2ff815e772c87e9946b17eae77511fccdf77"},"policy_orders_ref":{"path":"data/discovery/wave_69/stage_a/8ceee173bf9c9f8e498a058ba15e2d6e4d37ec3ce0b2b7caf8607ac63744ab5b/policy-orders.json","policy_orders_id":"policy-orders-sha256:e9c4988d0c0b322f218945295a345d8c2caae87c989b8665f76f35ba8d9bb427","schema_version":"partizan.policy_orders.v0.1","sha256":"5872cee2549d0a0ebc0c2e9747250eb1edd792cf3d82957d25a22aba99e34ebe"},"pool_id":"pool-sha256:56a5b80f3efcb435d895bb2ea34bd120f4dbefc803bf9351c200dad7aeb41c32","pool_manifest_ref":{"path":"data/discovery/wave_69/stage_a/8ceee173bf9c9f8e498a058ba15e2d6e4d37ec3ce0b2b7caf8607ac63744ab5b/pool-manifest.json","pool_id":"pool-sha256:56a5b80f3efcb435d895